Event_Name,tweet_id,Text,TimeStamp,User Info,Description
laAirportShooting2013,396402471498952704,RT @ToryBelleci: Just released from the secured holding area. Sighs of relief. This day doesn't seem real. #LAXShooting http://t.co/2WQwHB2…,Fri Nov 01 22:24:48 +0000 2013,Braden,
laAirportShooting2013,396402547004813312,RT @S1A2L345: So theres been a shootin in #lax airport? Since thats all I see trendin &amp; dont see #terrorist trendin Im going to assume it w…,Fri Nov 01 22:25:06 +0000 2013,Damion Humphreys,"Dual-classed; Level 43 Human, Level 5 Recovering Addict. Chaotic Good."
laAirportShooting2013,396402685416865792,"RT @TheMuslimGuy: BREAKING NEWS: Media reports saying that #LAX shooter was a ""young white male"" with rifle..Since it wasn't a brown dude..…",Fri Nov 01 22:25:39 +0000 2013,Fahad Yar Khan,
laAirportShooting2013,396403369071628289,"RT @cnnbrk: Official: #LAX gunman asked people, ""Are you #TSA?"" If they said no, he moved on. http://t.co/xuWPhFfeje",Fri Nov 01 22:28:22 +0000 2013,Female Enlightenment,7 May 1748 – 3 November 1793 A woman has the right to mount the scaffold. She must possess equally the right to mount the speaker's platform.
laAirportShooting2013,396404132422385665,RT @AlfredoFlores: My prayers are with the family of the TSA agent who was killed today at LAX and the other victims injured in this shooti…,Fri Nov 01 22:31:24 +0000 2013,aaaaa,i am who i am
laAirportShooting2013,396404283413102592,RT @AlfredoFlores: My prayers are with the family of the TSA agent who was killed today at LAX and the other victims injured in this shooti…,Fri Nov 01 22:32:00 +0000 2013,Thaay,
laAirportShooting2013,396405155827965953,Our sympathy with the victims of the LAX shooting. #LAX,Fri Nov 01 22:35:28 +0000 2013,fakecow,the home of animal-free clothing
laAirportShooting2013,396406489617031169,"RT @weeddude: According to @katywithawhy @CBSNews has obtained a photo of Paul Ciancia, the LAX shooting suspect http://t.co/IydbTQM7OC",Fri Nov 01 22:40:46 +0000 2013,(((bebird))),"planetary activist Twitter Freedom Fighter one heart, one mind, one world. Human rights global. in memory of Mo Nabbous, Mandiba, & Grandfather Commanda"
laAirportShooting2013,396407156544503808,RT @nbcnightlynews: LAX shooting suspect is 23-year-old Paul Anthony Ciancia. @PeteWilliamsNBC joins us now  with more on the suspect #NBCN…,Fri Nov 01 22:43:25 +0000 2013,Elle,
laAirportShooting2013,396407492051484672,RT @RT_America: DEVELOPING: #LAX shooting suspect sent text to his brother in which he admitted he was considering suicide http://t.co/3jRj…,Fri Nov 01 22:44:45 +0000 2013,Karl Lymer,Comic artist & writer. Likes: #anime #films #worldcinema #3D  #Blender #psychology I Am #creative and #wolves (the animal). Hate #DRM! #Straight
laAirportShooting2013,396408695824719873,BBC News - One person killed in Los Angeles airport shooting http://t.co/Swfr5FOgTk,Fri Nov 01 22:49:32 +0000 2013,Lin Okabe,Be less Thai and become more human.
laAirportShooting2013,396409081704898560,"ben: NJ Police: Dad Called, Worried About LAX Suspect: NJ Police: Dad Called, Worried About LAX Suspect, The... http://t.co/VyKomjFvH1",Fri Nov 01 22:51:04 +0000 2013,Lukas Ben,Writer at PET Ohio
laAirportShooting2013,396410407105363968,RT @PrisonPlanet: LAX shooter is 23-year-old Paul Ciancia. How long before we discover he was on anti-depressant drugs?,Fri Nov 01 22:56:20 +0000 2013,SyncopatedRumba,"That crazy Mulligan's droppin' 'em all over the place, baby."
laAirportShooting2013,396411698938011649,"BREAKING NEWS!!!!!!! 7 Injured at LAX, 2 Dead: TSA Agent, Shooter – Watch the Chaos: Video: UP... http://t.co/cHy165dApz #news #omg #bet",Fri Nov 01 23:01:28 +0000 2013,Dolla,
laAirportShooting2013,396412084851724288,Blessings to the LAX shooting victims...,Fri Nov 01 23:03:00 +0000 2013,RobbieLee,Creative (crafty) entrepreneur living in beautiful CO!  I'm the lady behind http://t.co/VY2YoJ3o4I + http://t.co/8B6WI0qjT2 + http://t.co/wpVTB1M9iY
laAirportShooting2013,396414190363348993,@AeolianMinor @MGG3980 glad you made it in after the shooting at the airport. Glad you are safe! Have fun!,Fri Nov 01 23:11:22 +0000 2013,Linda Ward,"CM fan, love my husband and my dog Oreo"
laAirportShooting2013,396414785970921472,RT @kateesackhoff: This whole #LAXShooting is heartbreaking. I'm so tired of hate &amp; evil...why can't we all just respect &amp; love one another…,Fri Nov 01 23:13:44 +0000 2013,Charles Wickham,"Feel free to talk to me anytime, leave a message please."
laAirportShooting2013,396420095968161792,Rt @ABCWorldNews: Alleged LAX shooter Paul Ciancia carried anti-government note: http://t.co/Shr8T2Ve1A,Fri Nov 01 23:34:50 +0000 2013,Unsilenced,Tweeting about issues that grab my attention. Dreaming of traveling the world reporting #BreakingNews. Help me achieve my dream. Thank You
laAirportShooting2013,396420175626383360,RT @myfoxla: #LAXShooting: Here's a map of the inside of Terminal 3 at #LAX Airport. http://t.co/j0oDw1nznS,Fri Nov 01 23:35:09 +0000 2013,Jasson Bautista,Arts and Culture Enthusiast. Photographer.
laAirportShooting2013,396425254945312768,"RT @pattonoswalt: Let's see if the gun rights advocates can wait a decent interval before spouting their bullsh -- oops, never mind. #LAX",Fri Nov 01 23:55:20 +0000 2013,Spencer Scott Holmes,"Creating Comics, Podcasts, VO & Videos, like #PizzaBoyz #WalabieTheRabbit, #DrunkBatman & #OldManOrangePodcast. If not that, I'm working out or retro gaming!"
laAirportShooting2013,396430258745774080,"""@ESQPolitics: There Is Nothing Random About The LAX Shooting http://t.co/bvDj47V01j"" This seems to be methodically planned #LAXShooting",Sat Nov 02 00:15:13 +0000 2013,Aghabi,"Instagram: @Aghabi.  Taking in every moment the best I know how. Chocolate loving, God fearing, Vegan wanna be."
laAirportShooting2013,396431567360237568,"LAX shooter identified; one dead, 6 injured http://t.co/2brWreHrM3",Sat Nov 02 00:20:25 +0000 2013,Ramtoad,Sic semper tyrannis
laAirportShooting2013,396431630296170496,"RT @PhillyInquirer: The #LAX shooting suspect graduated in 2008 from Salesianum School in Wilmington, Del., AP says--not Pennsville HS, as …",Sat Nov 02 00:20:40 +0000 2013,Poncepost,
laAirportShooting2013,396431751934779392,"Peoria: NJ police: Dad called, worried about LAX suspect http://t.co/T2wWFOD66F",Sat Nov 02 00:21:09 +0000 2013,Illinews,The news and updates that matter in Illinois.
laAirportShooting2013,396432569824051200,RT @DBOntarioNow: Father says LAX shooting suspect was suicidal http://t.co/ET9kEW2X8f,Sat Nov 02 00:24:24 +0000 2013,Brian Day,"Crime Reporter: San Gabriel Valley Tribune, Pasadena Star-News, Whittier Daily News - bday@scng.com"
laAirportShooting2013,396433060566421505,RT @biggovt: LAX Removed Armed Police from Security Checkpoints Months Ago: Just a few months before the shootings at LAX o... http://t.co/…,Sat Nov 02 00:26:21 +0000 2013,Rest_isSilence,"Faith brings you to the mountain, knowledge is why you stay or leave. With yesterday behind you, and if tomorrow never comes, will you live for God today?"
laAirportShooting2013,396436235637383168,#LAX Shooting – More Anti-Second Amendment Propaganda Already in Progress : Freedom Outpost http://t.co/HpxYmXj7Z7,Sat Nov 02 00:38:58 +0000 2013,Ed Vaisvilas,"Your Bic Lighter, and your Pocket Knife...Don't leave home without 'em!!!
Note to self:
People are not all they claim to be, especially online!"
laAirportShooting2013,396436705395220480,Fliers delayed following LAX shooting: Prolonged shutdown at the nation's third largest airport was particular... http://t.co/kTU9v3qANS,Sat Nov 02 00:40:50 +0000 2013,Sandra Jost,
laAirportShooting2013,396437657514823680,"RT @cnnbrk: FBI identifies Paul Anthony Ciancia, 23, as #LAX shooter. http://t.co/xuWPhFfeje",Sat Nov 02 00:44:37 +0000 2013,Alexander Assefa,Comedian/Actor/Writer/Producer/Creator of Comedycircuits/CEO of GREISPARQ LLC
laAirportShooting2013,396438186001711104,"RT @BostonGlobe: LAX shooting suspect sent text to sibling mentioning suicide, N.J. police chief says http://t.co/Z9a19sJjKg",Sat Nov 02 00:46:43 +0000 2013,Kevin KevveK' Mabry,"Likable, Lovable, Loving, Man. https://t.co/ok4bQ1wvij"
laAirportShooting2013,396439096140496897,"RT @cnnbrk: Shooting at #LAX affected nearly 750 flights, airport director says. http://t.co/bNciH0jZmW",Sat Nov 02 00:50:20 +0000 2013,Nadine Tan,I love my family and @ImRichardYap08's family. I'm a St. Jude Thaddeus Devotee.
laAirportShooting2013,396439532343533568,"RT @cnnbrk: Shooting at #LAX affected nearly 750 flights, airport director says. http://t.co/bNciH0jZmW",Sat Nov 02 00:52:04 +0000 2013,Clay Walker Books,"FB, IG, Pinterest:  @ClayWalkerBooks."
laAirportShooting2013,396440492852150272,RT @AlfredoFlores: My prayers are with the family of the TSA agent who was killed today at LAX and the other victims injured in this shooti…,Sat Nov 02 00:55:53 +0000 2013,rafael,suellen
laAirportShooting2013,396446402634448896,RT @frankmottek: @KNX1070 Business Hour pre-empted by expanded coverage of #LAXShooting Stay with KNX and @CBSLA Dow +70 NAS +2 S&amp;P +5,Sat Nov 02 01:19:22 +0000 2013,melody sixx,"Live,Feel,Smell,Taste,its running thru-you.So turn it up.Loud and proud.(LIFE)."
laAirportShooting2013,396446692028841984,Fliers Delayed After Los Angeles Airport Shooting http://t.co/w5u80GKhzA,Sat Nov 02 01:20:31 +0000 2013,Daily Digest,"Recaps, reviews, and summaries. We take the biggest trending news stories and break them down into readable chunks. Because ain't nobody got time for that."
laAirportShooting2013,396447161795096576,RT @myfoxphoenix: #LAXShooting update: 5 people hospitalized http://t.co/ggNTvJfDOR #FOX10,Sat Nov 02 01:22:23 +0000 2013,Ty Brennan,"Emmy award winning reporter/Weekend AM Anchor for FOX10 Phoenix. Runner, pilot, traveler and wannabe marathoner."
laAirportShooting2013,396447589610311680,"RT @tylerbatisteTNJ: Alleged shooter at LAX is a 2008 graduate of Salesianum, according to AP. #netDE #LAXShooting http://t.co/1w0lCoA5i1",Sat Nov 02 01:24:05 +0000 2013,Jules Clooney,"i tweet alot...I never needed acceptance from all you outsiders. #BucNation, #BBN, #CelticNation"
laAirportShooting2013,396447635764035584,RT @AlfredoFlores: My prayers are with the family of the TSA agent who was killed today at LAX and the other victims injured in this shooti…,Sat Nov 02 01:24:16 +0000 2013,maya,
laAirportShooting2013,396447816089747456,"RT @StellaInger Shooting at #LAX affected nearly 750 flights, airport director says. http://t.co/sG8rdUkqVN via @cnnbrk",Sat Nov 02 01:24:59 +0000 2013,memo12,"Without communication there is no relationship. Without respect there is no love, without trust there is no reason to continue..."
laAirportShooting2013,396448453623951360,Why he look photoshopped RT @ABC7: PHOTO: 23-year-old LAX shooting suspect Paul Ciancia http://t.co/LmaKVo7IMz http://t.co/1htSXMDN9i,Sat Nov 02 01:27:31 +0000 2013,Raw Captures,
laAirportShooting2013,396449586107002880,RT @DanielleCNN: Shooting at #LAX. Triage team setting up. Red = critical. Yellow = stable/needs treatment. Green = walking wounded. http:/…,Sat Nov 02 01:32:01 +0000 2013,BOSS MOSH(:187:),DANEL BA TA YO:)
laAirportShooting2013,396458545123573760,"Horrific LAX shooting scene: Actor, Tim Daly, describes to Brooke Baldwin the horrific shooting scene witnessed at the LAX airport.",Sat Nov 02 02:07:37 +0000 2013,DASCOmania,"Money is the root of all evil, that's the shit that keep me focused"
laAirportShooting2013,396461116240723968,RT @cnnbrk: Photo obtained by CNN appears to show a weapon on the floor at #LAX . http://t.co/xuWPhFfeje http://t.co/KipB68PPJq,Sat Nov 02 02:17:50 +0000 2013,Karol,Gerente de Producción Unión Radio Barquisimeto - Locutora en @lamega103 - Periodista en @elimpulsocom - Social Media Manager
laAirportShooting2013,396463351825313792,"On @WISN12News at 10, a #WhitefishBay man is desperate to get home to his family after spending the day at the #LAX airport.",Sat Nov 02 02:26:43 +0000 2013,Christina Palladino,"Nightside reporter at Fox 9. Mama, wife, born and raised Boston gal loving the Twin Cities! Share your story ideas at Christina.Palladino@foxtv.com"
laAirportShooting2013,396469269992448000,"LAX Shooting: TSA Agent Dead, Gunman In Custody At Airport (UPDATE) http://t.co/NmjNEHMTsC via @HuffPostCrime",Sat Nov 02 02:50:14 +0000 2013,Chris aka DJ Cee Bee,"Player of 70/80s disco/soul/funky and some other music genres, RT good stuff,  learning Forex Trader"
laAirportShooting2013,396469483885182976,Lone suspect in L.A. airport shooting used assault rifle: police http://t.co/wC1Og86aJ8,Sat Nov 02 02:51:05 +0000 2013,CyG TravelAgent,travel Earth and beyond ... be curious
laAirportShooting2013,396469676818960384,"RT @Marty2634: I want to Offer my Condolences to the Family of the TSA Agent who was Shot &amp; Killed at ""LAX Airport"" this Morning in LA!",Sat Nov 02 02:51:51 +0000 2013,Peter Ogburn,"I'm a producer. I produce. Seen/heard on @bpshow. SVP Programming for @dppodcasts. Food writing in @NPRFood @usatoday. All rights reserved, all wrongs reversed"
laAirportShooting2013,396470717010558976,Greenfield resident comes face to face with LAX shooter - http://t.co/xiKmN3FvcG,Sat Nov 02 02:55:59 +0000 2013,FOX6 LOCAL,"FOX6 Local News, strictly Local News."
laAirportShooting2013,396471161623556097,"RT @cnnbrk: TSA identifies officer killed in #LAX shooting as Gerardo Hernandez, 39. http://t.co/xuWPhFfeje",Sat Nov 02 02:57:45 +0000 2013,ChrissyFOX5,"Meteorologist.  Krav Maga Worldwide Student: level 4 (green belt). Journalist.   Show host/producer/writer. 
Sports Feature Reporter"
laAirportShooting2013,396471388086611968,Security agent is killed in shooting at airport http://t.co/Q7TtGHmGJw,Sat Nov 02 02:58:39 +0000 2013,Manish Agarwal,"Cricket, Aur Cricket, Phir Se Cricket, Ek Baar Aur Cricket, Start to Finish Cricket and all this after managing both Personal & Professional Commitments (y)"
laAirportShooting2013,396473439118057474,i watched #dracula and #grimm too hehe but who would do such a thing? Shooting at an airport...,Sat Nov 02 03:06:48 +0000 2013,☯ elliephant ☯,| ♡ don't let the door hit ya where mother nature split ya! ♡ |
laAirportShooting2013,396475414614659072,tobiehess leaving LAX  lucky us. Dodged a bullet #LAX shooter safe at home .But something's gotta… http://t.co/lb1X04KQxn,Sat Nov 02 03:14:39 +0000 2013,Actor Genie,The Mobile App to help actors and anyone interested in Film and TV navigate what's casting and who's who. Inspiration and insider information everyday.
laAirportShooting2013,396476760990437376,"RT @cnnbrk: Gunman at #LAX was shot in chest multiple times, intelligence source says. http://t.co/xuWPhFfeje",Sat Nov 02 03:20:00 +0000 2013,valencia woods,Live.Love.Laugh. -05/10/14- Follow Me & Ill Follow Back.
laAirportShooting2013,396478728131182594,"After today's airport shooting, people across Los Angeles were united by deep concern over how much longer the security lines will be now.",Sat Nov 02 03:27:49 +0000 2013,John Quaintance,"Floor model, some wear and tear."
laAirportShooting2013,396488618287431680,LAX shooting suspect made suicidal references to family: Paul Anthony Ciancia killed one TSA office... http://t.co/Y58oDgnleP #USA #News,Sat Nov 02 04:07:07 +0000 2013,America in Focus,#America in Focus!
laAirportShooting2013,396497858368520192,FBI: L.A. man is suspect in airport shooting: A man armed with what police say was an assault rifle and carryi... http://t.co/n123R9CtqT,Sat Nov 02 04:43:50 +0000 2013,Martin Schultz,College educated single dad liking Comedy
laAirportShooting2013,396498294538383360,"@CNN This is what you call breaking news? ""LAX shooter showed anti-TSA sentiment."" WHO HASN'T? Report something useful.",Sat Nov 02 04:45:34 +0000 2013,Aaron J. Angel,that one guy
laAirportShooting2013,396500890812968960,Praying for the people and families that was in Lax airport today,Sat Nov 02 04:55:53 +0000 2013,#Courtney Robin,The Black Elites
laAirportShooting2013,396502388204261376,Wait there was a shooting at the airport,Sat Nov 02 05:01:50 +0000 2013,Jordan,what's good playboy?  #ripav
laAirportShooting2013,396502774084407296,"Face-to-face with the airport gunman: Leon Saryan tells Anderson the LAX shooter walked right up to him, and ""... http://t.co/r3y4bhcMoM",Sat Nov 02 05:03:22 +0000 2013,Mr_Andres,Neva can tell
laAirportShooting2013,396519345754353664,"UPDATED: LA Airport Shooting Leaves News Networks Cautious, Celebrities Cub-Reporting, ‘Mad Men’ Crew Stranded http://t.co/aGalBPkMlQ",Sat Nov 02 06:09:13 +0000 2013,Daniel Zelter,Me.
laAirportShooting2013,396521405178580992,"To the shooter of LAX, what the fuck was your purpose to open fire?",Sat Nov 02 06:17:24 +0000 2013,Charlie ,Life's too short to drive boring cars | R35PECT RIP Paul Walker | Music | Art | Anime | Gaming | Autism Awareness | Born & Raised in Cali | 22 #FDT
laAirportShooting2013,396537171542163456,Suspect in LAX shooting apparently had suicidal thoughts before attack http://t.co/pSqBAMVD60,Sat Nov 02 07:20:03 +0000 2013,Hot News,
laAirportShooting2013,396542166966603776,"#LAXShooting: now what? #NRA supporters will ask for all passengers the right to carry a gun also at the airport, for self defense purposes?",Sat Nov 02 07:39:54 +0000 2013,Vincent Moro,"Design prostitute, occult persuader, coin up visual communicator, brain twister, independent thinker, trouble maker, problem solver."
laAirportShooting2013,396548659757596672,"TSA agent killed in Los Angeles airport shooting

http://t.co/Un2iAUjbfO",Sat Nov 02 08:05:42 +0000 2013,Jack Davies,Retired  police officer.
laAirportShooting2013,396550152951197696,"RT @ToryBelleci: Thank you #LAPD &amp; #TSA for securing today's horrible event &amp; thank you guys for all your concerns, prayers &amp; support. #LAX…",Sat Nov 02 08:11:38 +0000 2013,*SnowBunnie*,"Certified goofball, likes kids meals and #baseball #sfgiants. You only think you know me, those stories are made to scare you. Insta: Snowbunnie143"
laAirportShooting2013,396552027767308288,"RT @paidabribeNG: Paul Anthony Ciancia identified as LAX shooting suspect (Photo)

Authorities have identified the individual... http://t.c…",Sat Nov 02 08:19:05 +0000 2013,bala haruna,
laAirportShooting2013,396557740429959168,Deeply saddened about the events that took place at #LAX today. Not feeling safe to go anywhere anymore.,Sat Nov 02 08:41:47 +0000 2013,Bree,"Inspired by photography, design, travel, literature, film, theater, dance, and most of all my family, my other half [@JaredvMott], and my dog, Bear."
laAirportShooting2013,396566728827604993,RT @FBIPressOffice: Seeking Information in Los Angeles Airport Shootings: — Los Angeles http://t.co/kllbSjH3YM #FBI,Sat Nov 02 09:17:30 +0000 2013,Gilbert Algordo,"Google Admin, time traveller, Financial Analyst, Investor, Android Co-Creator, President of Alphabet Incorporated, ✡"
laAirportShooting2013,396575226479542272,RT @bellathorne: Tough day at the airport. Glad to be able to get home. Prayers for victims of LAX shooter.,Sat Nov 02 09:51:16 +0000 2013,PowerOfSelena,"One of the biggest fans of the one and only Selena Gomez!!! Follow back, too..."
laAirportShooting2013,396579118797844480,RT @FoxNews: TSA officer killed in #LAX shooting remembered as 'very proud' father http://t.co/I1OwwQwUgm,Sat Nov 02 10:06:44 +0000 2013,John,"Sports, music, wrestling, bowler, video gamer, mma and traveler! #gamerlife #ps4 #thewalkingdead #gameofthrones #Braves #Hawks #Falcons #truetoatlanta"
laAirportShooting2013,396579416580448257,Suspect in LAX shooting apparently had suicidal thoughts before attack http://t.co/eJJhRjQ5Bw,Sat Nov 02 10:07:55 +0000 2013,Maria Williams,"Collection of Top 500 Interesting Site covering meanigful business, sports, lifestyle, news, Fashion
Entertaintment, Politicts, Technology & Everthing else"
laAirportShooting2013,396583837389451264,Sott - Shooter's former roommate: LAX shooting suspect 'a nice guy' http://t.co/OoktS7TvJb,Sat Nov 02 10:25:29 +0000 2013,Mario Gregorio,"Born in 1956, Lazy writer specialised on Nostradamus's prophecies; crazy collector of old books about renaissance's prophecies; love financial forecasts..."
laAirportShooting2013,396586488168579072,RT @LAX_Official: Passengers unable to reclaim personal belongings with medical supplies/prescriptions contact LAX’s on-airport medical cli…,Sat Nov 02 10:36:01 +0000 2013,Kaiden,Be the person your dog thinks you are ♥
laAirportShooting2013,396589545845559296,RT @cnnbrk: KCAL/KCBS video appears to show LAX suspect handcuffed to a gurney. http://t.co/c5Z0nTvpXU,Sat Nov 02 10:48:10 +0000 2013,jim brown,
laAirportShooting2013,396601965188493312,#prayforlax #laxshooting http://t.co/4fSX5WesRL,Sat Nov 02 11:37:31 +0000 2013,Sharna Ultra Fans,"A unofficial fan twitter supporting the amazing, beautiful and talented @SharnaBurgess!! Sharna followed 01/04/14! Run by: @DanceLuvEmily"
laAirportShooting2013,396604112667545600,NJ police: LAX shooting suspect sent suicidal text,Sat Nov 02 11:46:03 +0000 2013,Cambell Zook,
laAirportShooting2013,396608059486650368,Paul Anthony Ciancia Nominato come Shooting LAX Suspect http://t.co/iqJaTz39AQ,Sat Nov 02 12:01:44 +0000 2013,notizie italia,
laAirportShooting2013,396619828728848385,"RT @CNN: Law enforcement: materials found on LAX suspect included rant referencing conspiracy theory, the New World Order http://t.co/gQIUy…",Sat Nov 02 12:48:30 +0000 2013,Q SΔVΔGΞ ™,Promoter• Entrepreneur • Realist
laAirportShooting2013,396640900886970368,Questions surround LAX suspect's motive http://t.co/ND2O12yFbd,Sat Nov 02 14:12:14 +0000 2013,Maria Williams,"Collection of Top 500 Interesting Site covering meanigful business, sports, lifestyle, news, Fashion
Entertaintment, Politicts, Technology & Everthing else"
laAirportShooting2013,396646953268043776,Have questions about what happened at LAX or airport security in general? Feel free to ask us.,Sat Nov 02 14:36:17 +0000 2013,NYCAviation,"Educating & entertaining on all things aviation: news, analysis, consulting, photos, planespotting, weather & travel updates, beyond NYC! RIP EIC @MattMolnar."
laAirportShooting2013,396647188157452289,Gunman targets TSA in Los Angeles airport shooting http://t.co/v9PN62djJA via #NewzSocial,Sat Nov 02 14:37:13 +0000 2013,NewzTweet,An automated twitter solution for B2B marketing
laAirportShooting2013,396649243349241857,Mad Men Cast And Crew 'Caught In The Middle Of LA Airport Shooting' http://t.co/y59IWKRfGs,Sat Nov 02 14:45:23 +0000 2013,EntertainmentWise,Welcome to a world of entertainment.
laAirportShooting2013,396650333880848384,Suspect in LAX shooting apparently had suicidal thoughts before attack | Fox News http://t.co/kxIEmMHuKV via @foxnews,Sat Nov 02 14:49:43 +0000 2013,JA Hitchcock,"Cybercrime & cyberbullying expert, author, president of WHOA http://t.co/5yxWIk0RuC & http://t.co/kfe6o4vVHN 2015 Mary Litynski Award http://t.co/xGUbysSPiS"
laAirportShooting2013,396653852897722368,"RT @intelwire: Motive of suicidal guy carrying anti-gov tract during airport shooting spree ""a mystery"" authorities say http://t.co/bQPl3iA…",Sat Nov 02 15:03:42 +0000 2013,Kat in a Hat,"An unauthorized, unofficial view of war, politics and life from beyond Socrates' knee

--Never come to a gunfight with a plastic spork and a Rubik's Cube"
laAirportShooting2013,396654012277092353,"Script Flipped: LAX Shooter Is Mad At �Intrusive Security Screenings�, Had Note Mentioning �NWO� http://t.co/v0wOmdAKCZ",Sat Nov 02 15:04:20 +0000 2013,Steven,Janitor
laAirportShooting2013,396656252048007170,"#LAX Shooting #MANNEQUIN strolld out on CBS claimed was wounded #TSA #FalseFlag? http://t.co/K2Y7YCMKR1 http://t.co/K96GQTMAU0
#ImpeachObama",Sat Nov 02 15:13:14 +0000 2013,#RebelAlliance,NRA Anonymous Veterans Christians Teaparty Truckers Bikers Occupy #redmeat anarchists preppers stopwatching.us #TPFA etc... Don't See Your Faction? Let Me Know.
laAirportShooting2013,396656751178944512,"RT @jricole: So shooting down people at an airport is *not* terrorism, but carrying a flashdrive with evidence of gov't wrongdoing *is* ter…",Sat Nov 02 15:15:13 +0000 2013,MidEast Observer,Observing Greater Middle East with focus on #Palestine #Syria #Lebanon #Iraq #Iran and #GCC.Also highlighting gaps & biases in #Media | RTs ≠ Endorsements
laAirportShooting2013,396656776319623168,"RT @jricole: So shooting down people at an airport is *not* terrorism, but carrying a flashdrive with evidence of gov't wrongdoing *is* ter…",Sat Nov 02 15:15:19 +0000 2013,Von,life
laAirportShooting2013,396658135269515265,RT @nowthisnews: Just who was the LAX shooter? Find out here: http://t.co/1qou0uS6h8,Sat Nov 02 15:20:43 +0000 2013,Lea Caldwell,"I love the Web! Changed my major to Information Systems,  going for the masters. It's better to learn development on your own and with mentors."
laAirportShooting2013,396661360706064384,L.A. Ontario Airport ‘October Drill’ Nearly Identical to LAX Shooting Scene http://t.co/8B7sOIDXl1,Sat Nov 02 15:33:32 +0000 2013,TheAntiType,"55+ non #MSM newsfeeds, plus anything else #Liberty/RonPaul over at @azureblade7v2 Global News for the people, by the people. http://t.co/Ew4mBBC3AE"
laAirportShooting2013,396662019211808769,Motive Unclear in Deadly Los Angeles Airport Shooting http://t.co/BSq6p56i6J,Sat Nov 02 15:36:09 +0000 2013,CyG TravelAgent,travel Earth and beyond ... be curious
laAirportShooting2013,396664909108219904,"RT @KTLA: Parking Structure #3 has reopened at LAX. All parking structures at airport now open, officials say - http://t.co/ipu1IQ0hxC @LAX…",Sat Nov 02 15:47:38 +0000 2013,Time To Wake Up News,"We post & share Breaking News, Weather, Earthquakes, TRUTH, & Everything Else! Also, Please LIKE US on FB. Please Subscribe to 2020CHRISTOF on YouTube. :)"
