Event_Name,tweet_id,Text,TimeStamp,User Info,Description
laAirportShooting2013,396363577721765888,One killed in LA airport shooting: A suspect is in custody after one person was killed and seven wou... http://t.co/dMfBeNLeRt (#sprnch),Fri Nov 01 19:50:15 +0000 2013,SpRncH,We was IT before you knew of a facebook. :)
laAirportShooting2013,396363904848515072,"RT @BBCBreaking: Federal security officer killed in shooting at Los Angeles International Airport #LAX, officials say http://t.co/lcchvUHw2e",Fri Nov 01 19:51:33 +0000 2013,maxwell drift,love living life to the fullest
laAirportShooting2013,396364286550736896,"LAX Shooter Kills TSA Agent, Prompts Mass Evacuation, Airport Lockdown http://t.co/aBPWge1D4Z",Fri Nov 01 19:53:04 +0000 2013,Herby Duverne,"Principal and CEO at Taino Consulting Group, a Risk Management firm that focuses on #cyber and #physical #security. #TainoCG #NU"
laAirportShooting2013,396364383007563776,LAX shooting suspect is 23-year old Paul Anthony Ciancia,Fri Nov 01 19:53:27 +0000 2013,Trenton Scott H.,"Official Twitter profile for Trenton Scott Higareda, Vice President and Senior Security Consultant for CTI Consulting."
laAirportShooting2013,396364462719922176,RT @AmericanAir: We’ve updated our Travel Policy due to the incident at #LAX. Please check here for details: http://t.co/8T5JjPLyex,Fri Nov 01 19:53:46 +0000 2013,Marilyn Moore,#PJNET
laAirportShooting2013,396364819214761984,Harrowing. RT @latimes #LAX shooting: Officials say shooter was ticketed passenger http://t.co/Rf8bhoEeEW,Fri Nov 01 19:55:11 +0000 2013,Aarti Virani,"Arts & culture scribe. Brazen Bollyphile. Contributing Editor, @VogueIndia, @StoryWorldwide. @NewhouseSU alum. Mera Joota Hai Japani - no, really."
laAirportShooting2013,396365125403160576,Watch live coverage of #LAXShooting http://t.co/CBJRoBlhTX,Fri Nov 01 19:56:24 +0000 2013,Aerospace Info,"Air show coverage, aerospace and aviation info. 
Contributing writer to http://t.co/E4q9gOfikv. Now on Google+ and YouTube"
laAirportShooting2013,396365221872549888,RT @RealAlexJones: UPDATE: Flip-Flop: LAX Shooter Was Not a TSA Worker - http://t.co/vCfdtH46Xw,Fri Nov 01 19:56:47 +0000 2013,Robert Bassett,
laAirportShooting2013,396365431583170560,"Timeline: Recent threats, attacks at #LAX http://t.co/nCoBp1QfEI #LAXShooting",Fri Nov 01 19:57:37 +0000 2013,The Sun,Local. News. Matters. We are San Bernardino County's local news source. #LocalNewsMatters
laAirportShooting2013,396365502907686913,"RT @pattonoswalt: Let's see if the gun rights advocates can wait a decent interval before spouting their bullsh -- oops, never mind. #LAX",Fri Nov 01 19:57:54 +0000 2013,Rachel Khona,"Writer + card designer. Credits include Playboy, Washington Post, NYT, Maxim, and Cosmo. Likes: Cheese + Rock n' Roll. Dislikes: lint + sewer smells."
laAirportShooting2013,396366698275934208,"#LAX shooting: Man opens fire with rifle, kills TSA worker, wounds 3 others http://t.co/GVkKGT5gDE",Fri Nov 01 20:02:39 +0000 2013,Susi,I was born a leader so its ok to Follow. Thoughts are my own.
laAirportShooting2013,396366903788044288,"RT @VictoriaTaft: Off duty @PPB officer helpless bystander at #LAX ,""And she said this was actually the one time she decided not to... http…",Fri Nov 01 20:03:28 +0000 2013,WyleeCoyoteJim,Watch out roadrunner.
laAirportShooting2013,396366991868456960,RT @kellieo79: What happened to responsible journalism?? Too much misinformation floating around...#LAXShooting,Fri Nov 01 20:03:49 +0000 2013,Chip Douglas,"A fan of all things interesting, like semi-colons and tracking great white shark activity. Broncos, Avs, and golf addict. And this isn't my name. Denver."
laAirportShooting2013,396367201596215297,Really? When someone uses hash tag 'whatajoke' because flights are delayed at #LAX it's a sign to unfollow them.,Fri Nov 01 20:04:39 +0000 2013,jolenemarie,
laAirportShooting2013,396367222550970369,Dont worry-not hurt or guilty. I'm tired of being huddled on the sidewalk &amp; not knowing when guns will stop or if I'll get to Bali #LAX,Fri Nov 01 20:04:44 +0000 2013,FabulouslyAwkwardLiz,"1/2 woman, who's trying to take over the world--1/2 barefoot loving , southern belle--100% fan of saying INDUBITABLY #FabulouslyAwkwardGirl"
laAirportShooting2013,396367339983503360,@DRUDGE_REPORT So how did he get past security with a gun? #LAX #Obama #TSA,Fri Nov 01 20:05:12 +0000 2013,John Anthony,
laAirportShooting2013,396368233386999808,RT @washingtonpost: Law enforcement official: Suspect in #LAXshooting is alive and being treated at hospital http://t.co/rymryvEhCy #LAX,Fri Nov 01 20:08:45 +0000 2013,Karen-Kay Harrison,"Entrepreneur; beach-lover; change-seeker; great listener. Happy; optimistic; foodie, social butterfly; starry-eyed traveler. Life's great - how's your journey?"
laAirportShooting2013,396368648622727168,"RT @cnnbrk: At least 2 #TSA agents shot at #LAX: 1 died, 1 wounded in leg, TSA says. http://t.co/xuWPhFfeje",Fri Nov 01 20:10:24 +0000 2013,Moe Kadado,
laAirportShooting2013,396368724107616256,RT @sanpedrotoday: Watch LAX police chief (and San Pedran) Patrick Gannon answer questions about the #LAXshooting in a press... http://t.co…,Fri Nov 01 20:10:42 +0000 2013,Brian C,Husband Father #Mohrrior Full of Useless Information 17x #THTC
laAirportShooting2013,396368938008723456,RT @heatherhoylee: The shooting at LAX is going to make airport security even more of a pain in the ass,Fri Nov 01 20:11:33 +0000 2013,Brittney Pierce,mommy to anthony owen
laAirportShooting2013,396369097425829888,"RT @nbcwashington: #BREAKING: Suspect arrested in #LAX shooting is 23-year-old Paul Anthony Ciancia, a U.S. citizen: http://t.co/ea6UdVFrWu",Fri Nov 01 20:12:11 +0000 2013,James,Flordia
laAirportShooting2013,396369776873717760,RT @CodySimpson: stuck in the airport terminal because of the shootings. praying for the victims,Fri Nov 01 20:14:53 +0000 2013,Imay Drews ♛,everybody makes mistakes.
laAirportShooting2013,396370309575876608,RT @CBSLA: UPDATE: #LACoroner confirms 40y/o man has died.Unclear if its #TSA agent who was reported killed during #LAXShooting. http://t.c…,Fri Nov 01 20:17:00 +0000 2013,Cammy Dierking,Wife; Mom; WKRC-TV Local 12 News Anchor; Motivational Speaker; 3-time Ironman.
laAirportShooting2013,396370573795655680,RT @CodySimpson: stuck in the airport terminal because of the shootings. praying for the victims,Fri Nov 01 20:18:03 +0000 2013,เบลเบื่อ,เบลไงจะใครล่ะ
laAirportShooting2013,396370582184263680,RT @NASHOVERSTREET: Keep the victims at LAX in your prayers.  I hate hearing about senseless acts like this. So sad.,Fri Nov 01 20:18:05 +0000 2013,Kathy,"Big time crush on a big time klutz, he looks so good, so I hoot and holler, he goes by the name Tony Oller. cred: @omjitsrachel 62.40.39.27.2.1. 4/3"
laAirportShooting2013,396370598957711360,One killed in LA airport shooting http://t.co/3PDnsosk37,Fri Nov 01 20:18:09 +0000 2013,Mr Kingsley,"With God,My every move is a calculated step to bring me closer to embrace an early wealth."
laAirportShooting2013,396370598970277888,"RT @eonline: Stay safe, L.A.--we're keeping everyone involved in the #LAXShooting in our prayers! ♥",Fri Nov 01 20:18:09 +0000 2013,Jordan VanRemmen,"""Trust in the Lord with all your heart and lean not on your own understanding."" //Proverbs 3:5//"
laAirportShooting2013,396370619949789184,Live: LAX shooting: 'Multiple victims' hit; at least 7 hurt http://t.co/pqT8tQUhH1,Fri Nov 01 20:18:14 +0000 2013,Kate Northey,Spontaneous adventurer with a coffee addiction that rivals Lorelai Gilmore. Not ashamed to say I do things for the gram. ✨
laAirportShooting2013,396370741572427776,RT @KristinDavis: Thank you to the @TSA #LAPD and everyone who came together today at #LAX  to help,Fri Nov 01 20:18:43 +0000 2013,Wayne Sisk♘,"I have no words of wisdom, but I'll tweet them anyway."
laAirportShooting2013,396370758361825280,"RT @LadyVeteran23: #LAXShooting will be followed by gun control legislation that will promise ""if you like your gun, you can keep it"" (for …",Fri Nov 01 20:18:47 +0000 2013,"Oh, Donna","Conservative, Christian, fiercely patriotic, wife, mother, grandmother, Finance Director, AND totally fed up with the direction our country is headed."
laAirportShooting2013,396370976461832192,RT @wilw: I am shocked — shocked — that LAX shooter used an AR-15. It’s almost like that gun only exists to kill as many people as quickly …,Fri Nov 01 20:19:39 +0000 2013,Vincent Avatar,"Boy, it's real fucked up out there."
laAirportShooting2013,396371542692487168,RT @cnnbrk: Photo obtained by CNN appears to show a weapon on the floor at #LAX . http://t.co/xuWPhFfeje http://t.co/KipB68PPJq,Fri Nov 01 20:21:54 +0000 2013,Kyle,I'm the boy thats single. ....
laAirportShooting2013,396372092146290688,"RT @BBCBreaking: Federal security officer killed in shooting at Los Angeles International Airport #LAX, officials say http://t.co/lcchvUHw2e",Fri Nov 01 20:24:05 +0000 2013,Shelley,
laAirportShooting2013,396372394140774400,Shooting at LAX today... :( So sad. I am so grateful to live in a Country that has gun control. #LAX #LAXShooting #guncontrol,Fri Nov 01 20:25:17 +0000 2013,D,
laAirportShooting2013,396372608024727552,#BREAKING: LOS ANGELES (AP) -- Law enforcement officials identify LA airport shooting suspect as 23-year-old Paul Ciancia. #wsbtv,Fri Nov 01 20:26:08 +0000 2013,Brett Rosner,"Digital @wsbtv Previous: @HyperVocal, @MyNews13 | Come at me bro: Brett.Rosner@wsbtv.com"
laAirportShooting2013,396372775826636800,RT @Brosner85: #BREAKING: LOS ANGELES (AP) -- Law enforcement officials identify LA airport shooting suspect as 23-year-old Paul Ciancia. #…,Fri Nov 01 20:26:48 +0000 2013,Rasheed Abou-Alsamh,Saudi-American columnist for @JornalOGlobo. Latin America correspondent for @arab_news.
laAirportShooting2013,396372750639435776,RT @jamiekilstein: Do we....do we bomb Iraq? #lax,Fri Nov 01 20:26:42 +0000 2013,Racy Ⓥ,Bad Ass in training #CitizenRadio #BlackLivesMatter #Warren2020 #TrumpHasTinyHands #NastyWoman
laAirportShooting2013,396372775826636800,RT @Brosner85: #BREAKING: LOS ANGELES (AP) -- Law enforcement officials identify LA airport shooting suspect as 23-year-old Paul Ciancia. #…,Fri Nov 01 20:26:48 +0000 2013,Rasheed Abou-Alsamh,Saudi-American columnist for @JornalOGlobo. Latin America correspondent for @arab_news.
laAirportShooting2013,396375002984878082,RT @rauldemolina: El rifle que se usó en el tiroteo del aeropuerto de #LAX hoy donde murió un #TSA y varios heridos http://t.co/bdVqDaxsck,Fri Nov 01 20:35:39 +0000 2013,Abelardo Castillo,Es un orgullo ser mexicano
laAirportShooting2013,396375002993287168,"RT @BreakingNews: Law enforcement officials identify Los Angeles airport shooting suspect as 23-year-old Paul Ciancia - @AP, @NBCNews",Fri Nov 01 20:35:39 +0000 2013,Bobby,award winning tv watcher. new gadgets and tech turn me on.
laAirportShooting2013,396375493705863169,"""@calebtedictator: Modern warfare 2 predictes the LAX shooting"" wtf smh lol literally only thing in common was that it was AT an airport",Fri Nov 01 20:37:36 +0000 2013,2natez,AK to KY
laAirportShooting2013,396376022217543680,One killed in LA airport shooting: A suspect is in custody after a transportation official was killed and seven injured in a shooting...,Fri Nov 01 20:39:42 +0000 2013,ROSALYN LIM,
laAirportShooting2013,396377234346631168,RT @AlfredoFlores: My prayers are with the family of the TSA agent who was killed today at LAX and the other victims injured in this shooti…,Fri Nov 01 20:44:31 +0000 2013,lô,não olha pra ele que ele é envolvido no esquema.
laAirportShooting2013,396377934820171776,"Lone suspect in Los Angeles #LAX airport shooting named to US media as Paul Ciancia, 23, by law enforcement officials http://t.co/0LZfFKpYqN",Fri Nov 01 20:47:18 +0000 2013,USA NEWS,
laAirportShooting2013,396377943196196864,"RT @TheLeadCNN: #LAXShooting witness VernonCardenas: As soon as I saw him, I knew he was the shooter bc he wasn't moving with urgency. #The…",Fri Nov 01 20:47:20 +0000 2013,EagleNXS1,"Eduquemos a nuestros hijos y a aquellos sin memoria, El mundo necesita de sus ciudadanos. Por una Patria Honrada y Generosa. Juan 14:6. #IstandforIsrael"
laAirportShooting2013,396378257781575680,@theyoungballa @xomputer Yes! Initial reports had multiple suspects. But #MSM quick to perpetuate #loneshooter #propaganda. #LAXShooting,Fri Nov 01 20:48:35 +0000 2013,Conscious Algorithm,Keenly observing the 21st century unfold from the fringes of finitude.
laAirportShooting2013,396378798842580992,RT @AlfredoFlores: My prayers are with the family of the TSA agent who was killed today at LAX and the other victims injured in this shooti…,Fri Nov 01 20:50:44 +0000 2013,K,"so blunt, you could smoke me."
laAirportShooting2013,396379050496626688,Suspected LAX shooter in custody; multiple injuries http://t.co/HSTuXgMZWP,Fri Nov 01 20:51:44 +0000 2013,Michael Diaz,nut for cars trucks and so on and so on...
laAirportShooting2013,396380682068320256,#LAXshooting: Officers didn’t hesitate to confront gunman - Daily Bulletin - http://t.co/ooJZdZqguB,Fri Nov 01 20:58:13 +0000 2013,Mike Cruz,"City Editor -- The Sun | @sbsun | San Bernardino, CA | Southern California News Group (SCNG) | mcruz@scng.com"
laAirportShooting2013,396381218960572416,NBC News’ Pete Williams: LAX Shooter Paul Anthony Ciancia Had ‘Strong Anti-Government Views’ | Mediaite http://t.co/4kuo4QCYEe,Fri Nov 01 21:00:21 +0000 2013,Facility Executive,"Facility Executive keeps facility management professionals up-to-date on the latest practices, products, and services in the field."
laAirportShooting2013,396381466428325888,NBC News: LAX Shooter Anti-Government http://t.co/HtTmjRTe22,Fri Nov 01 21:01:20 +0000 2013,John Muriango,#Evangelical #Christian #Reformed #CalviDispy #Baptist #Conservative #ProLife #TeamJesus #tcot #Cessationist #Blogger #Marketer #Capitalist #Arsenal
laAirportShooting2013,396381520941699072,"RT @AP: LAX latest:
_ Police ID shooting suspect as Paul Ciancia. 
_ TSA worker killed, 2 others wounded.
_ Shooting disrupts flights natio…",Fri Nov 01 21:01:33 +0000 2013,KAZUU,"Running, Fitness, Reading, Cooking, Berry, Yogurt, Blue Cheese & Coffee Lover. KUL, SLC, WAS, TPE, BKK, HCM & Fujizakura Surviver."
laAirportShooting2013,396381814539182080,RT @AlfredoFlores: My prayers are with the family of the TSA agent who was killed today at LAX and the other victims injured in this shooti…,Fri Nov 01 21:02:43 +0000 2013,oneflydrew,TPF ♚.
laAirportShooting2013,396382074602405888,Suspect shot and in police custody. Witnesses say it was pandemonium. Chaos at #LAX. A gunman walked in and a TSA agent Killed. #Unreal,Fri Nov 01 21:03:45 +0000 2013,Tony Monaco,Z1035 Toronto Announcer Winner of TNC #BestRadioPersonality 7 years in a row & 8 of the past 9 years. Join me every Friday at IVY Social Club Vaughan.
laAirportShooting2013,396383064441761792,RT @nytimes: Updated: At least 7 people were injured in shooting by gunman at Los Angeles International Airport http://t.co/aMkeNeWVii,Fri Nov 01 21:07:41 +0000 2013,El Viti,"Si has construido castillos en el aire, tu trabajo no se pierde; ahora coloca las bases debajo de ellos."
laAirportShooting2013,396383299314417665,"RT @BreakingNews: 133 flights cancelled, 293 delayed after shooting at Los Angeles airport - @latimes http://t.co/vhYBBAwKJd",Fri Nov 01 21:08:37 +0000 2013,Ian Bloomfield,Self employed dad of 2. Supporter of Ipswich Town FC & England. Enjoys twitter & looking to meet new people. Loves to rant & say how I see it. Views all mine.
laAirportShooting2013,396383483855003648,"RT @911LAPD: Per @LAX_Official, the next #LAX News Briefing will be 4pm. #Media staging area is now located @ #LAWA Administration visitors…",Fri Nov 01 21:09:21 +0000 2013,CHP Central LA,Official Twitter feed for the CHP Central Los Angeles Area. This account is not monitored 24/7. For emergencies dial 9-1-1.
laAirportShooting2013,396384394044141568,"TSA agent killed, six wounded in Los Angeles airport shooting http://t.co/MGbw4jalT5",Fri Nov 01 21:12:58 +0000 2013,TECHVU,"Follow us and stay updated with the technology news, tips and techniques."
laAirportShooting2013,396384670847623169,RT @QueenPetraK: Law enforcement sources: #LAX suspect is 23-year-old man with addresses in L.A. and New Jersey. via CNN http://t.co/X45Erb…,Fri Nov 01 21:14:04 +0000 2013,Maritess,Official Twitter Account of Maritess Garcia
laAirportShooting2013,396384792495026176,RT @AlfredoFlores: My prayers are with the family of the TSA agent who was killed today at LAX and the other victims injured in this shooti…,Fri Nov 01 21:14:33 +0000 2013,carol,JUSTIN BIEBER FOLLOWS
laAirportShooting2013,396384876389478400,RT @dinahjane97: OMG just heard about the shooting at the LAX AIRPORT #prayingNoonegothurt,Fri Nov 01 21:14:53 +0000 2013,NELEB PHOENIX,Fuck you anyway! Lalalala I love singing. Music. Instruments. Books. Movies.
laAirportShooting2013,396385153192587264,"RT @cnnbrk: Official: #LAX gunman asked people, ""Are you #TSA?"" If they said no, he moved on. http://t.co/xuWPhFfeje",Fri Nov 01 21:15:59 +0000 2013,Charles Bender,"a Reagan conservative. less government. term limits. born on Christmas day. Cubs fan, Patroits fan and Michigan fan, saw my first Michigan game in 1966."
laAirportShooting2013,396385799148957696,RT @BradWillis: I am halfway across the world &amp; Twitter is bringing me news of the #LAX shooting faster than CNN’s site. This is…the new ag…,Fri Nov 01 21:18:33 +0000 2013,LaVona Andrew,"Interpreter, interrupter, troublemaker, peacemaker, searcher, daughter, mother, teacher, & student; fan of Oxford commas and semicolons--as well as the em-dash."
laAirportShooting2013,396386184987148288,RT @koconews: LAX suspect shot; TSA officer killed http://t.co/uKWSCHVJZk,Fri Nov 01 21:20:05 +0000 2013,Jalisa Debro,
laAirportShooting2013,396386277299609600,RT @joshtrujillo: Scene inside #LAX via @TJD19083:  https://t.co/Fm8g5X06sO,Fri Nov 01 21:20:27 +0000 2013,David Ryder,Photographer & filmmaker
laAirportShooting2013,396386549929365505,"RT @cnnbrk: Official: #LAX gunman asked people, ""Are you #TSA?"" If they said no, he moved on. http://t.co/xuWPhFfeje",Fri Nov 01 21:21:32 +0000 2013,Gisele Regatao,"Journalism professor @Baruchcollege. Creator of #CelestialBlood bilingual radionovela podcast, with @KCRW. Always reporter of all arts and cultures. Ex @WNYC"
laAirportShooting2013,396387120333344768,"LAX suspect shot; TSA officer killed: A man ""pulled an assault rifle out of a bag and began to open fire"" Friday... http://t.co/INbHjMMWIu",Fri Nov 01 21:23:48 +0000 2013,Santa Fe News,"http://t.co/HwTfLGgRmR presents the best Twitter feeds from Santa Fe, New Mexico. A community service from @EmilyMedvec"
laAirportShooting2013,396387258728980480,"RT @cnnbrk: Official: #LAX gunman asked people, ""Are you #TSA?"" If they said no, he moved on. http://t.co/xuWPhFfeje",Fri Nov 01 21:24:21 +0000 2013,Foster,"The Mind of Allen Foster: #Random Raw, and Uncut. #ASU Grad, Member of Phi Beta Sigma Fraternity Incorporated by way of Beta Psi. #GOMAB or go home. ΦBΣ #iGrind"
laAirportShooting2013,396387506200932352,"LAX Airport Shooting: Mythbusters' Grant Imahara, Tory Belleci ""Safe"" After Being Inside Terminal http://t.co/gJX1n47b13",Fri Nov 01 21:25:20 +0000 2013,Celebrity Kristen,"God makes some Holy Faces in the Universe, 
what can we do instead of Love them..."
laAirportShooting2013,396387929829806080,"The alleged LAX shooter reportedly had a hand-written note that said he ""wanted to kill TSA and pigs."" http://t.co/jlL2tSufSz",Fri Nov 01 21:27:01 +0000 2013,The Week,All you need to know about everything that matters.
laAirportShooting2013,396388072457129984,RT @AlfredoFlores: My prayers are with the family of the TSA agent who was killed today at LAX and the other victims injured in this shooti…,Fri Nov 01 21:27:35 +0000 2013,Vall.,| JUSTIN FOLLOWS | JOE JONAS IS LIFE |
laAirportShooting2013,396388219262357504,"RT @cnnbrk: Federal official: #LAX suspect had materials expressing anti-government sentiment, anger at TSA. http://t.co/xuWPhFfeje",Fri Nov 01 21:28:10 +0000 2013,B.J. Jansen,Baritone Saxophonist - ARC Recording Artist - Yanagisawa (Japan)/Conn-Selmer (USA) Artist/Clinician - Ligaphone Paris Endorser
laAirportShooting2013,396389309776797697,RT @AriDavidUSA: Breaking news! #LAXShooting suspect identified as Aziz Durkha Jihad! He reportedly went on rampage after trying to purchas…,Fri Nov 01 21:32:30 +0000 2013,• Eyra •,•• im an ailurophile ••
laAirportShooting2013,396390270268616705,@Annabanamw right. He got through security and started shooting in the gate area. They shut down the airport today. It's breaking news lol,Fri Nov 01 21:36:19 +0000 2013,Taylor Collins,Im an awkward child.
laAirportShooting2013,396391029437251584,LAX Gunman Identified After Airport Shooting Spree: A gunman armed with an assault rifle entered a terminal at... http://t.co/6mm2cCweBJ,Fri Nov 01 21:39:20 +0000 2013,James Epstein,We make better soccer with better trailers for you!
laAirportShooting2013,396392350639194112,"RT @airlinegeeks: RT @ohareaviation: Terminal 1, 2 and TBIT open at #LAX @LAX_Official. Terminal 3 still closed. #LAXShooting. LA ATC busy …",Fri Nov 01 21:44:35 +0000 2013,Flight-Report,"The leading social media dedicated to flight reviews, 9000+ users, 250 000+ comments & 17 000+ reports! FAQ: https://t.co/Bew7mw1PzC"
laAirportShooting2013,396392359027433473,RT @AlfredoFlores: My prayers are with the family of the TSA agent who was killed today at LAX and the other victims injured in this shooti…,Fri Nov 01 21:44:37 +0000 2013,Andrea,
laAirportShooting2013,396392505836462081,"RT @BuzzFeedNews: Pennsville, NJ police chief: #LAXshooting suspect texted family Friday that he was thinking of killing himself. http://t.…",Fri Nov 01 21:45:12 +0000 2013,Twitsnoop,Snooping the web to provide Breaking News coverage
laAirportShooting2013,396392736527376384,"RT @ABC7: #LAX UPDATE: Airport getting ready to allow employees back into Terminal 2, according to LAPD http://t.co/4WISRGIiyI via @ABC7Elex",Fri Nov 01 21:46:07 +0000 2013,Reeni,"MOTHER of 3, LOVE God, Country, People, Politics, & Our U.S. Military. TOLERANCE & APATHY ARE THE LAST VIRTUES OF A DYING SOCIETY ~UNKNOWN [ProfanityFreeZone]"
laAirportShooting2013,396393407599230976,RT @russmulry: Are you an Australian at LAX? Contact @angelacox7news if you are. #LAX #LAXShooting,Fri Nov 01 21:48:47 +0000 2013,Harry Bennett,"Belfast born, Westham Utd supporter for over 40yrs. Music lover, audio nut."
laAirportShooting2013,396395232121483264,"LAX Shooting -- VIDEO Shows Chaos, Panic: Panic and chaos erupted after a gunman opened fire at L.A. International Airport ... and th...",Fri Nov 01 21:56:02 +0000 2013,N. aARON,
laAirportShooting2013,396395949343268864,"Suspect in custody after Los Angeles airport shooting, police say (Christian Science Monitor): Share With Frie... http://t.co/zHKOOnbbz0",Fri Nov 01 21:58:53 +0000 2013,Ejeheri Martins Ayo,Founder of the mademat group(the future of entrepreneurship in Africa)''PERSISTENCE IS THE SUSTAINED EFFORT NECESSARY TO INDUCE FAITH''. +2349053487361.
laAirportShooting2013,396396326835195904,"LAX suspect shot, TSA officer killed http://t.co/BUFuekgMNU",Fri Nov 01 22:00:23 +0000 2013,Demetrius Brown,Founder Gold Standard Security
laAirportShooting2013,396397253775994880,"RT @iCollectNews: LAX Shooter Identified, ""Wanted To Kill TSA And Pigs"" http://t.co/8YfWAZg5Vn",Fri Nov 01 22:04:04 +0000 2013,Retweet Fanatic,re-tweeting #awareness
laAirportShooting2013,396397325062373376,"Due to news coverage of the shootings at LAX, viewers in Los Angeles can see today’s #YR at 2:05AM.",Fri Nov 01 22:04:21 +0000 2013,Young & The Restless,"Get the latest news, exclusive interviews and more! Weekdays on CBS Daytime."
laAirportShooting2013,396397333468176384,RT @ToryBelleci: Almost 4 hrs since the shooting. Still here. 2000+ people. They're handing out waters &amp; snacks. #LAXShooting http://t.co/N…,Fri Nov 01 22:04:23 +0000 2013,Salman O,A F1 & live music fanatic! & a bit of TV show addict.Heavy Metal & speed metal enthusiast. Hmm food and technology hmm wow this bunch of ramdon crap isn't'
laAirportShooting2013,396399992635547648,RT @ToryBelleci: Almost 4 hrs since the shooting. Still here. 2000+ people. They're handing out waters &amp; snacks. #LAXShooting http://t.co/N…,Fri Nov 01 22:14:57 +0000 2013,Sarah Newland,catholic church survivor I am supporting humans who feel justice is alluding them. I am transsexual. I am a survivor.
laAirportShooting2013,396400118468837376,Cheers in the terminal. First flight boarding since the lock down. Happy travelers. #LAX,Fri Nov 01 22:15:27 +0000 2013,Kate Barlow,https://t.co/cgrg6M60Zb.sports.dodgers.humor.customer success
laAirportShooting2013,396400286240997376,Witnesses describe intense scene at LAX shooting: LOS ANGELES - Los Angeles International Airport was a scene of... http://t.co/ger0DQDAyU,Fri Nov 01 22:16:07 +0000 2013,Stockton Buzz,"Curating the best media feeds in Stockton. Part of the 400-city The Breaking News Network, the largest community news network supporting the social good."
laAirportShooting2013,396401628452225024,Timeline For LAX Shooting - 'Multiple victims' hit; gunman had rifle. http://t.co/Nm0fJUGfmK,Fri Nov 01 22:21:27 +0000 2013,AIN News Desk,The place for news on the international freight networking world!
laAirportShooting2013,396401812988641280,"FBI Los Angeles confirms shooter identity as Paul Anthony Ciancia, 23 of LA. #LAXShooting",Fri Nov 01 22:22:11 +0000 2013,Casey Wian,CNN West/Midwest Newsgathering Director. Retweets are NOT endorsements.
laAirportShooting2013,396401905250754560,Security increasd at Bob Hope Airport due 2 LAX shootin http://t.co/pPuhYT5OJa #BobHopeAirport #JennyWedge #LAX #VictorGill,Fri Nov 01 22:22:33 +0000 2013,LA Daily Newz,Parody account. Newz fo' Mo'Fo' LA Gangstaz! #Gangsta #followback #hiphop
